{
  "schema_version": 1,
  "id": "flutter-scroll-texture-view",
  "kind": "real",
  "title": "Android 15 Flutter TextureView scroll",
  "description": "Existing Flutter scrolling fixture rendered through TextureView.",
  "scene": "scrolling",
  "tags": ["android", "flutter", "scrolling", "textureview"],
  "aliases": ["Scroll-Flutter-327-TextureView.pftrace"],
  "known_issues": [
    "The original capture reports seven trace_sorter_negative_timestamp_dropped health events."
  ],
  "trace": {
    "file": "trace.pftrace",
    "format": "perfetto-protobuf",
    "sha256": "645deaa9fc564e0ea33072c83f5ecf1d0a6f53a97055cc98c640e8294deb315e",
    "materialization": "committed"
  },
  "android": {
    "release": "15",
    "api_level": 35,
    "device": "nubia pacific",
    "build_fingerprint": "nubia/pacific/pacific:15/1.4.1.0/101:user/release-keys",
    "compatibility": {"min_api": 35, "max_api": 35}
  },
  "source": {
    "origin": "SmartPerfetto maintainer-owned or authorized test capture; public distribution approved 2026-08-21",
    "captured_at": null,
    "imported_at": "2026-07-13T00:00:00.000Z",
    "license": "AGPL-3.0-or-later",
    "consent": "owner-approved",
    "privacy_review": "approved",
    "sanitization_review": "approved",
    "publication": "public",
    "evidence_tier": "R1"
  },
  "analysis": {
    "results": ["analysis/Scroll-Flutter-327-TextureView.pftrace.fps_report.txt"],
    "logs": []
  },
  "coverage": {
    "skills": [],
    "strategies": [],
    "expectations": [
      {
        "id": "sql-smartperfetto-scrolling-jank-frames-positive",
        "type": "sql",
        "target": "smartperfetto.scrolling.jank_frames",
        "mode": "semantic",
        "source_file": "backend/sql/smartperfetto/scrolling/jank_frames.sql",
        "source_sha256": "43a79e80f2e720e272bed117549b0aa89e10c8d2bc1dc2f73f04c22ce72cf72d",
        "query": "SELECT frame_id, start_ts, dur_ns, jank_type, process_name, is_jank FROM smartperfetto_scrolling_jank_frames ORDER BY dur_ns DESC LIMIT 100",
        "required_columns": ["frame_id", "start_ts", "dur_ns", "jank_type", "process_name", "is_jank"],
        "assertions": [
          {"column": "dur_ns", "operator": "gt", "value": 0},
          {"column": "is_jank", "operator": "eq", "value": 1}
        ]
      }
    ]
  }
}
