{
  "schema_version": 1,
  "id": "android-startup-light",
  "kind": "real",
  "title": "Android 16 light startup",
  "description": "Existing SmartPerfetto light application startup fixture captured on a Google raven device.",
  "scene": "startup",
  "tags": ["android", "startup", "light"],
  "aliases": ["launch_light.pftrace"],
  "trace": {
    "file": "trace.pftrace",
    "format": "perfetto-protobuf",
    "sha256": "6c5479fd1b765ee4d29692c43a8204b972bc0f97eb373aca98ea7e11e99fd8b4",
    "materialization": "committed"
  },
  "android": {
    "release": "16",
    "api_level": 36,
    "device": "Google raven",
    "build_fingerprint": "google/raven_beta/raven:16/BP31.250523.010/13667654:user/release-keys",
    "compatibility": {"min_api": 36, "max_api": 36}
  },
  "source": {
    "origin": "SmartPerfetto maintainer-owned or authorized test capture; public distribution approved 2026-08-21",
    "captured_at": null,
    "imported_at": "2026-07-13T00:00:00.000Z",
    "license": "AGPL-3.0-or-later",
    "consent": "owner-approved",
    "privacy_review": "approved",
    "sanitization_review": "approved",
    "publication": "public",
    "evidence_tier": "R1"
  },
  "analysis": {
    "results": ["analysis/launch_light.pftrace.fps_report.txt"],
    "logs": []
  },
  "coverage": {
    "skills": [],
    "strategies": [],
    "expectations": [
      {
        "id": "sql-smartperfetto-binder-victim-to-server-positive",
        "type": "sql",
        "target": "smartperfetto.binder.victim_to_server",
        "mode": "semantic",
        "source_file": "backend/sql/smartperfetto/binder/victim_to_server.sql",
        "source_sha256": "d341de807918382d7d81eac563c401ac63e17ff7e6360f82d46f88cb09dfc8d9",
        "query": "SELECT client_dur_ns, client_process, server_process, is_sync, binder_txn_id, binder_reply_id FROM smartperfetto_binder_victim_to_server WHERE is_sync = 1 AND client_dur_ns > 0 ORDER BY client_dur_ns DESC LIMIT 100",
        "required_columns": ["client_dur_ns", "client_process", "server_process", "is_sync", "binder_txn_id", "binder_reply_id"],
        "assertions": [
          {"column": "client_dur_ns", "operator": "gt", "value": 0},
          {"column": "binder_txn_id", "operator": "gt", "value": 0}
        ]
      }
    ]
  }
}
