{
  "schema_version": 1,
  "id": "device-identity-oukitel-wp62",
  "kind": "constructed",
  "title": "OUKITEL WP62 device identity metadata",
  "description": "Device identity only: replays the SystemInfo android_build_fingerprint, android_soc_model, android_sdk_version that a OUKITEL WP62 capture recorded, over the android-scroll-standard real base. It is not a OUKITEL WP62 trace: apart from this identity and the case marker slice, every packet comes from the base.",
  "scene": "general",
  "purpose": "fixture",
  "tags": [
    "android",
    "constructed",
    "device-identity",
    "metadata-only"
  ],
  "known_issues": [
    "Derived metadata, not a device trace: only android_build_fingerprint, android_soc_model, android_sdk_version come from the OUKITEL WP62 capture; processes, scheduling, slices and all other metadata belong to the android-scroll-standard base.",
    "The source capture is kept outside this repository. Its device serial number and every other per-unit identifier were removed; only build-level identity is kept."
  ],
  "aliases": [],
  "trace": {
    "file": "trace.overlay.pftrace",
    "format": "perfetto-protobuf",
    "sha256": "a046faa89d565fb85ae6be01428cac98398863b43a3bcc3f4762748e6071211c",
    "materialization": "base-plus-overlay"
  },
  "android": {
    "release": "15",
    "api_level": 35,
    "device": "OUKITEL WP62 identity over nubia pacific base",
    "build_fingerprint": "OUKITEL/WP62_A15_EEA/WP62:15/AP3A.240905.015.A2/2025491:user/release-keys",
    "compatibility": {
      "min_api": 35,
      "max_api": 35
    }
  },
  "source": {
    "origin": "SmartPerfetto deterministic trace generator; device identity values copied from a maintainer device capture that is not committed",
    "captured_at": null,
    "imported_at": "2026-10-04T00:00:00.000Z",
    "license": "AGPL-3.0-or-later",
    "consent": "maintainer decision 2026-10-04: commit build-level device identity only",
    "privacy_review": "approved",
    "sanitization_review": "approved",
    "publication": "public",
    "evidence_tier": "R3"
  },
  "analysis": {
    "results": [
      "analysis/expected.json"
    ],
    "logs": []
  },
  "construction": {
    "base_case_id": "android-scroll-standard",
    "scenario_file": "scenario.json",
    "generator_version": 1,
    "seed": "device-identity-oukitel-wp62-v1",
    "output": "Trace/.generated/constructed/device-identity-oukitel-wp62/trace.pftrace",
    "runtime_revision": "99234d73fe356bf7edf6b2cb7afcf2a9eefc5368"
  },
  "coverage": {
    "skills": [],
    "strategies": [],
    "expectations": []
  }
}
