{
  "schema_version": 1,
  "id": "android-scroll-customer",
  "kind": "real",
  "title": "Android 16 customer scroll",
  "description": "Existing customer scrolling fixture with multiple gesture and jank events.",
  "scene": "scrolling",
  "tags": ["android", "scrolling", "customer", "jank"],
  "aliases": ["scroll-demo-customer-scroll.pftrace"],
  "trace": {
    "file": "trace.pftrace",
    "format": "perfetto-protobuf",
    "sha256": "1015ba963c49cd57d08d8997c4c48027026f2d6e41f7eb72b4b1356e39f7af3a",
    "materialization": "committed"
  },
  "android": {
    "release": "16",
    "api_level": 36,
    "device": "OPPO PKH110",
    "build_fingerprint": "OPPO/PKH110/OP5DC1L1:16/AP3A.240617.008/V.2a01376-7328d8-769621:user/release-keys",
    "compatibility": {"min_api": 36, "max_api": 36}
  },
  "source": {
    "origin": "SmartPerfetto maintainer-owned or authorized test capture; public distribution approved 2026-08-21",
    "captured_at": null,
    "imported_at": "2026-07-13T00:00:00.000Z",
    "license": "AGPL-3.0-or-later",
    "consent": "owner-approved",
    "privacy_review": "approved",
    "sanitization_review": "approved",
    "publication": "public",
    "evidence_tier": "R1"
  },
  "analysis": {
    "results": ["analysis/scroll-demo-customer-scroll.pftrace.fps_report.txt"],
    "logs": []
  },
  "coverage": {
    "skills": [],
    "strategies": [],
    "expectations": [
      {
        "id": "sql-smartperfetto-scrolling-jank-frames-positive",
        "type": "sql",
        "target": "smartperfetto.scrolling.jank_frames",
        "mode": "semantic",
        "source_file": "backend/sql/smartperfetto/scrolling/jank_frames.sql",
        "source_sha256": "43a79e80f2e720e272bed117549b0aa89e10c8d2bc1dc2f73f04c22ce72cf72d",
        "query": "SELECT frame_id, start_ts, dur_ns, jank_type, process_name, is_jank FROM smartperfetto_scrolling_jank_frames ORDER BY dur_ns DESC LIMIT 100",
        "required_columns": ["frame_id", "start_ts", "dur_ns", "jank_type", "process_name", "is_jank"],
        "assertions": [
          {"column": "dur_ns", "operator": "gt", "value": 0},
          {"column": "is_jank", "operator": "eq", "value": 1}
        ]
      }
    ]
  }
}
