{
  "schema_version": 1,
  "id": "device-identity-pixel-6-pro",
  "kind": "constructed",
  "title": "Google Pixel 6 Pro device identity metadata",
  "description": "Device identity only: replays the SystemInfo android_build_fingerprint, android_device_manufacturer, android_soc_model, android_sdk_version that a Google Pixel 6 Pro capture recorded, over the android-scroll-customer real base. It is not a Google Pixel 6 Pro trace: apart from this identity and the case marker slice, every packet comes from the base.",
  "scene": "general",
  "purpose": "fixture",
  "tags": [
    "android",
    "constructed",
    "device-identity",
    "metadata-only"
  ],
  "known_issues": [
    "Derived metadata, not a device trace: only android_build_fingerprint, android_device_manufacturer, android_soc_model, android_sdk_version come from the Google Pixel 6 Pro capture; processes, scheduling, slices and all other metadata belong to the android-scroll-customer base.",
    "The source capture is kept outside this repository. Its device serial number and every other per-unit identifier were removed; only build-level identity is kept."
  ],
  "aliases": [],
  "trace": {
    "file": "trace.overlay.pftrace",
    "format": "perfetto-protobuf",
    "sha256": "a9175a5bcbe4dc867bdfb85858177b74bc5cffb8711d4fc2b88f9bb5f68be2cc",
    "materialization": "base-plus-overlay"
  },
  "android": {
    "release": "CinnamonBun",
    "api_level": 37,
    "device": "Google Pixel 6 Pro identity over OPPO PKH110 base",
    "build_fingerprint": "google/raven_beta/raven:CinnamonBun/CP31.260508.005.A1/15421647:user/release-keys",
    "compatibility": {
      "min_api": 37,
      "max_api": 37
    }
  },
  "source": {
    "origin": "SmartPerfetto deterministic trace generator; device identity values copied from a maintainer device capture that is not committed",
    "captured_at": null,
    "imported_at": "2026-10-04T00:00:00.000Z",
    "license": "AGPL-3.0-or-later",
    "consent": "maintainer decision 2026-10-04: commit build-level device identity only",
    "privacy_review": "approved",
    "sanitization_review": "approved",
    "publication": "public",
    "evidence_tier": "R3"
  },
  "analysis": {
    "results": [
      "analysis/expected.json"
    ],
    "logs": []
  },
  "construction": {
    "base_case_id": "android-scroll-customer",
    "scenario_file": "scenario.json",
    "generator_version": 1,
    "seed": "device-identity-pixel-6-pro-v1",
    "output": "Trace/.generated/constructed/device-identity-pixel-6-pro/trace.pftrace",
    "runtime_revision": "99234d73fe356bf7edf6b2cb7afcf2a9eefc5368"
  },
  "coverage": {
    "skills": [],
    "strategies": [],
    "expectations": []
  }
}
