{
  "schema_version": 1,
  "id": "flutter-scroll-surface-view",
  "kind": "real",
  "title": "Android 15 Flutter SurfaceView scroll",
  "description": "Existing WeChat Flutter scrolling fixture rendered through SurfaceView.",
  "scene": "scrolling",
  "tags": ["android", "flutter", "scrolling", "surfaceview", "wechat"],
  "aliases": ["Scroll-Flutter-SurfaceView-Wechat-Wenyiwen.pftrace"],
  "trace": {
    "file": "trace.pftrace",
    "format": "perfetto-protobuf",
    "sha256": "e876c56b5d7290acda596e73929c1a127df4255e9ca6951605dad40833e67a53",
    "materialization": "committed"
  },
  "android": {
    "release": "15",
    "api_level": 35,
    "device": "nubia pacific",
    "build_fingerprint": "nubia/pacific/pacific:15/1.4.1.0/101:user/release-keys",
    "compatibility": {"min_api": 35, "max_api": 35}
  },
  "source": {
    "origin": "SmartPerfetto maintainer-owned or authorized test capture; public distribution approved 2026-08-21",
    "captured_at": null,
    "imported_at": "2026-07-13T00:00:00.000Z",
    "license": "AGPL-3.0-or-later",
    "consent": "owner-approved",
    "privacy_review": "approved",
    "sanitization_review": "approved",
    "publication": "public",
    "evidence_tier": "R1"
  },
  "analysis": {
    "results": ["analysis/Scroll-Flutter-SurfaceView-Wechat-Wenyiwen.pftrace.fps_report.txt"],
    "logs": []
  },
  "coverage": {
    "skills": [],
    "strategies": [],
    "expectations": [
      {
        "id": "sql-smartperfetto-scrolling-jank-frames-negative",
        "type": "sql",
        "target": "smartperfetto.scrolling.jank_frames",
        "mode": "negative",
        "source_file": "backend/sql/smartperfetto/scrolling/jank_frames.sql",
        "source_sha256": "43a79e80f2e720e272bed117549b0aa89e10c8d2bc1dc2f73f04c22ce72cf72d",
        "query": "SELECT frame_id, start_ts, dur_ns, jank_type, process_name, is_jank FROM smartperfetto_scrolling_jank_frames ORDER BY dur_ns DESC LIMIT 100",
        "expected_empty_reason": "This real Flutter SurfaceView capture does not expose janky actual FrameTimeline rows through the pinned android.frames.timeline module."
      }
    ]
  }
}
