{
  "schema_version": 1,
  "id": "android-startup-heavy",
  "kind": "real",
  "title": "Android 16 heavy startup",
  "description": "Existing SmartPerfetto heavy application startup fixture captured on a Xiaomi pandora device.",
  "scene": "startup",
  "tags": ["android", "startup", "heavy"],
  "aliases": ["lacunh_heavy.pftrace"],
  "trace": {
    "file": "trace.pftrace",
    "format": "perfetto-protobuf",
    "sha256": "2a0c7b85e7f4a14e43b7f8d6de21172e05eba1ed3ad8ef7df539bb5e59b6ba63",
    "materialization": "committed"
  },
  "android": {
    "release": "16",
    "api_level": 36,
    "device": "Xiaomi pandora",
    "build_fingerprint": "Xiaomi/pandora/pandora:16/BP2A.250605.031.A3/OS3.0.34.0.WBLCNXM:user/release-keys",
    "compatibility": {"min_api": 36, "max_api": 36}
  },
  "source": {
    "origin": "SmartPerfetto maintainer-owned or authorized test capture; public distribution approved 2026-08-21",
    "captured_at": null,
    "imported_at": "2026-07-13T00:00:00.000Z",
    "license": "AGPL-3.0-or-later",
    "consent": "owner-approved",
    "privacy_review": "approved",
    "sanitization_review": "approved",
    "publication": "public",
    "evidence_tier": "R1"
  },
  "analysis": {
    "results": ["analysis/lacunh_heavy.pftrace.fps_report.txt"],
    "logs": []
  },
  "coverage": {
    "skills": [],
    "strategies": [],
    "expectations": [
      {
        "id": "sql-smartperfetto-binder-victim-to-server-positive",
        "type": "sql",
        "target": "smartperfetto.binder.victim_to_server",
        "mode": "semantic",
        "source_file": "backend/sql/smartperfetto/binder/victim_to_server.sql",
        "source_sha256": "d341de807918382d7d81eac563c401ac63e17ff7e6360f82d46f88cb09dfc8d9",
        "query": "SELECT client_dur_ns, client_process, server_process, is_sync, binder_txn_id, binder_reply_id FROM smartperfetto_binder_victim_to_server WHERE is_sync = 1 AND client_dur_ns > 0 ORDER BY client_dur_ns DESC LIMIT 100",
        "required_columns": ["client_dur_ns", "client_process", "server_process", "is_sync", "binder_txn_id", "binder_reply_id"],
        "assertions": [
          {"column": "client_dur_ns", "operator": "gt", "value": 0},
          {"column": "binder_txn_id", "operator": "gt", "value": 0}
        ]
      }
    ]
  }
}
